Title,Description,Director,Year,Runtime (Minutes),Votes,Metascore,Rating
The Book of Life,"Manolo, a young man who is torn between fulfilling the expectations of his family and following his heart, embarks on an adventure that spans three fantastic worlds where he must face his greatest fears.",Jorge R. Gutiérrez,2014,95,50388,67,7.3
Incendies,"Twins journey to the Middle East to discover their family history, and fulfill their mother's last wishes.",Denis Villeneuve,2010,131,92863,80,8.2
The Heartbreak Kid,A newly wed man who believes he's just gotten hitched to the perfect woman encounters another lady on his honeymoon.,Bobby Farrelly,2007,116,74664,46,5.8
Happy Feet,"Into the world of the Emperor Penguins, who find their soul mates through song, a penguin is born who cannot sing. But he can tap dance something fierce!",George Miller,2006,108,141141,77,6.5
Entourage,"Movie star Vincent Chase, together with his boys Eric, Turtle, and Johnny, are back - and back in business with super agent-turned-studio head Ari Gold on a risky project that will serve as Vince's directorial debut.",Doug Ellin,2015,104,64557,38,6.6
The Strangers,A young couple staying in an isolated vacation home are terrorized by three unknown assailants.,Bryan Bertino,2008,86,96718,47,6.2
Noah,A man is chosen by his world's creator to undertake a momentous mission before an apocalyptic flood cleanses the world.,Darren Aronofsky,2014,138,209700,68,5.8
Neighbors,"After they are forced to live next to a fraternity house, a couple with a newborn baby do whatever they can to take them down.",Nicholas Stoller,2014,97,236500,68,6.4
Nymphomaniac: Vol. II,"The continuation of Joe's sexually dictated life delves into the darker aspects of her adulthood, obsessions and what led to her being in Seligman's care.",Lars von Trier,2013,123,65824,60,6.7
Wild,"A chronicle of one woman's 1,100-mile solo hike undertaken as a way to recover from a recent personal tragedy.",Jean-Marc Vallée,2014,115,95553,76,7.1
Grown Ups,"After their high school basketball coach passes away, five good friends and former teammates reunite for a Fourth of July holiday weekend.",Dennis Dugan,2010,102,190385,30,6
Blair Witch,"After discovering a video showing what he believes to be his vanished sister Heather, James and a group of friends head to the forest believed to be inhabited by the Blair Witch.",Adam Wingard,2016,89,26088,47,5.1
The Karate Kid,"Work causes a single mother to move to China with her young son; in his new home, the boy embraces kung fu, taught to him by a master.",Harald Zwart,2010,140,127983,61,6.2
Dark Shadows,"An imprisoned vampire, Barnabas Collins, is set free and returns to his ancestral home, where his dysfunctional descendants are in need of his protection.",Tim Burton,2012,113,209326,55,6.2
Friends with Benefits,"A young man and woman decide to take their friendship to the next level without becoming a couple, but soon discover that adding sex only leads to complications.",Will Gluck,2011,109,286543,63,6.6
The Illusionist,"In turn-of-the-century Vienna, a magician uses his abilities to secure the love of a woman far above his social standing.",Neil Burger,2006,110,309934,68,7.6
The A-Team,"A group of Iraq War veterans looks to clear their name with the U.S. military, who suspect the four men of committing a crime for which they were framed.",Joe Carnahan,2010,117,219116,47,6.8
The Guest,"A soldier introduces himself to the Peterson family, claiming to be a friend of their son who died in action. After the young man is welcomed into their home, a series of accidental deaths seem to be connected to his presence.",Adam Wingard,2014,100,71069,76,6.7
The Internship,"Two salesmen whose careers have been torpedoed by the digital age find their way into a coveted internship at Google, where they must compete with a group of young, tech-savvy geniuses for a shot at employment.",Shawn Levy,2013,119,166342,42,6.3
Paul,Two British comic-book geeks traveling across the U.S. encounter an alien outside Area 51.,Greg Mottola,2011,104,201707,57,7
This Beautiful Fantastic,"A young woman who dreams of being a children's author makes an unlikely friendship with a cantankerous, rich old widower.",Simon Aboud,2016,100,688,51,6.9
The Da Vinci Code,A murder inside the Louvre and clues in Da Vinci paintings lead to the discovery of a religious mystery protected by a secret society for two thousand years -- which could shake the foundations of Christianity.,Ron Howard,2006,149,338280,46,6.6
Mr. Church,"""Mr. Church"" tells the story of a unique friendship that develops when a little girl and her dying mother retain the services of a talented cook - Henry Joseph Church. What begins as a six month arrangement instead spans into fifteen years and creates a family bond that lasts forever.",Bruce Beresford,2016,104,16163,37,7.7
Hugo,"In Paris in 1931, an orphan named Hugo Cabret who lives in the walls of a train station is wrapped up in a mystery involving his late father and an automaton.",Martin Scorsese,2011,126,259182,83,7.5
The Blackcoat's Daughter,Two girls must battle a mysterious evil force when they get left behind at their boarding school over winter break.,Oz Perkins,2015,93,4155,68,5.6
Body of Lies,A CIA agent on the ground in Jordan hunts down a powerful terrorist leader while being caught between the unclear intentions of his American supervisors and Jordan Intelligence.,Ridley Scott,2008,128,182305,57,7.1
Knight of Cups,A writer indulging in all that Los Angeles and Las Vegas has to offer undertakes a search for love and self via a series of adventures with six different women.,Terrence Malick,2015,118,17439,53,5.7
The Mummy: Tomb of the Dragon Emperor,"In the Far East, Alex O'Connell, the son of famed mummy fighters Rick and Evy O'Connell, unearths the mummy of the first Emperor of Qin -- a shape-shifting entity cursed by a witch centuries ago.",Rob Cohen,2008,112,124554,31,5.2
The Boss,"A titan of industry is sent to prison after she's caught insider trading. When she emerges ready to rebrand herself as America's latest sweetheart, not everyone she screwed over is so quick to forgive and forget.",Ben Falcone,2016,99,29642,40,5.4
Hands of Stone,The legendary Roberto Duran and his equally legendary trainer Ray Arcel change each other's lives.,Jonathan Jakubowicz,2016,111,8998,54,6.6
El secreto de sus ojos,A retired legal counselor writes a novel hoping to find closure for one of his past unresolved homicide cases and for his unreciprocated love with his superior - both of which still haunt him decades later.,Juan José Campanella,2009,129,144524,80,8.2
True Grit,A tough U.S. Marshal helps a stubborn teenager track down her father's murderer.,Ethan Coen,2010,110,254904,80,7.6
We Are Your Friends,"Caught between a forbidden romance and the expectations of his friends, aspiring DJ Cole Carter attempts to find the path in life that leads to fame and fortune.",Max Joseph,2015,96,25903,46,6.2
A Million Ways to Die in the West,"As a cowardly farmer begins to fall for the mysterious new woman in town, he must put his new-found courage to the test when her husband, a notorious gun-slinger, announces his arrival.",Seth MacFarlane,2014,116,144779,44,6.1
Only for One Night,A married womans husband with a perfect life cheats with her sister with extreme consequences befalling them all.,Chris Stokes,2016,86,313,60,4.6
Rules Don't Apply,"The unconventional love story of an aspiring actress, her determined driver, and their boss, eccentric billionaire Howard Hughes.",Warren Beatty,2016,127,3731,,5.7
Ouija: Origin of Evil,"In 1967 Los Angeles, a widowed mother and her 2 daughters add a new stunt to bolster their seance scam business, inviting an evil presence into their home.",Mike Flanagan,2016,99,30035,65,6.1
Percy Jackson: Sea of Monsters,"In order to restore their dying safe haven, the son of Poseidon and his friends embark on a quest to the Sea of Monsters to find the mythical Golden Fleece while trying to stop an ancient evil from rising.",Thor Freudenthal,2013,106,91684,39,5.9
Fracture,"An attorney, intent on climbing the career ladder toward success, finds an unlikely opponent in a manipulative criminal he is trying to prosecute.",Gregory Hoblit,2007,113,148943,68,7.2
Oculus,"A woman tries to exonerate her brother, who was convicted of murder, by proving that the crime was committed by a supernatural phenomenon.",Mike Flanagan,2013,104,92875,61,6.5
In Bruges,"Guilt-stricken after a job gone wrong, hitman Ray and his partner await orders from their ruthless boss in Bruges, Belgium, the last place in the world Ray wants to be.",Martin McDonagh,2008,107,322536,67,7.9
This Means War,Two top CIA operatives wage an epic battle against one another after they discover they are dating the same woman.,McG,2012,103,154400,31,6.3
Lída Baarová,A film about the black-and-white era actress Lída Baarová and her doomed love affair.,Filip Renc,2016,106,353,64,5
The Road,"In a dangerous post-apocalyptic world, an ailing father defends his son as they slowly travel to the sea.",John Hillcoat,2009,111,187302,,7.3
Lavender,"After losing her memory, a woman begins to see unexplained things after her psychiatrist suggests she visit her childhood home.",Ed Gass-Donnelly,2016,92,2083,46,5.2
Deuces,An agent infiltrates a crime ring ran by a charismatic boss.,Jamal Hill,2016,87,256,36,6.6
Conan the Barbarian,A vengeful barbarian warrior sets off to get his revenge on the evil warlord who attacked his village and murdered his father when he was a boy.,Marcus Nispel,2011,113,84893,,5.2
The Fighter,"A look at the early years of boxer ""Irish"" Micky Ward and his brother who helped train him before going pro in the mid 1980s.",David O. Russell,2010,116,290056,79,7.8
August Rush,"A drama with fairy tale elements, where an orphaned musical prodigy uses his gift as a clue to finding his birth parents.",Kirsten Sheridan,2007,114,91229,38,7.5
Chef,"A head chef quits his restaurant job and buys a food truck in an effort to reclaim his creative promise, while piecing back together his estranged family.",Jon Favreau,2014,114,151970,68,7.3
Eye in the Sky,"Col. Katherine Powell, a military officer in command of an operation to capture terrorists in Kenya, sees her mission escalate when a girl enters the kill zone triggering an international dispute over the implications of modern warfare.",Gavin Hood,2015,102,57826,73,7.3
Eagle Eye,"Jerry and Rachel are two strangers thrown together by a mysterious phone call from a woman they have never met. Threatening their lives and family, she pushes Jerry and Rachel into a series of increasingly dangerous situations, using the technology of everyday life to track and control their every move.",D.J. Caruso,2008,118,156158,43,6.6
The Purge,"A wealthy family are held hostage for harboring the target of a murderous syndicate during the Purge, a 12-hour period in which any and all crime is legal.",James DeMonaco,2013,85,154588,41,5.7
PK,"A stranger in the city asks questions no one has asked before. His childlike curiosity will take him on a journey of love, laughter, and letting go.",Rajkumar Hirani,2014,153,103279,51,8.2
Ender's Game,"Young Ender Wiggin is recruited by the International Military to lead the fight against the Formics, a genocidal alien race which nearly annihilated the human race in a previous invasion.",Gavin Hood,2013,114,194236,,6.7
Indiana Jones and the Kingdom of the Crystal Skull,"Famed archaeologist/adventurer Dr. Henry ""Indiana"" Jones is called back into action when he becomes entangled in a Soviet plot to uncover the secret behind mysterious artifacts known as the Crystal Skulls.",Steven Spielberg,2008,122,351361,65,6.2
Paper Towns,"After an all night adventure, Quentin's life-long crush, Margo, disappears, leaving behind clues that Quentin and his friends follow on the journey of a lifetime.",Jake Schreier,2015,109,72515,56,6.3
High-Rise,Life for the residents of a tower block begins to run out of control.,Ben Wheatley,2015,119,25928,65,5.7
Quantum of Solace,"James Bond descends into mystery as he tries to stop a mysterious organization from eliminating a country's most valuable resource. All the while, he still tries to seek revenge over the death of his love.",Marc Forster,2008,106,347798,58,6.6
The Assignment,"After waking up and discovering that he has undergone gender reassignment surgery, an assassin seeks to find the doctor responsible.",Walter Hill,2016,95,2043,34,4.5
How to Train Your Dragon,"A hapless young Viking who aspires to hunt dragons becomes the unlikely friend of a young dragon himself, and learns there may be more to the creatures than he assumed.",Dean DeBlois,2010,98,523893,74,8.1
Lady in the Water,"Apartment building superintendent Cleveland Heep rescues what he thinks is a young woman from the pool he maintains. When he discovers that she is actually a character from a bedtime story who is trying to make the journey back to her home, he works with his tenants to protect his new friend from the creatures that are determined to keep her in our world.",M. Night Shyamalan,2006,110,82701,36,5.6
The Fountain,"As a modern-day scientist, Tommy is struggling with mortality, desperately searching for the medical breakthrough that will save the life of his cancer-stricken wife, Izzi.",Darren Aronofsky,2006,96,199193,51,7.3
Cars 2,Star race car Lightning McQueen and his pal Mater head overseas to compete in the World Grand Prix race. But the road to the championship becomes rocky as Mater gets caught up in an intriguing adventure of his own: international espionage.,John Lasseter,2011,106,110490,57,6.2
31,"Five carnival workers are kidnapped and held hostage in an abandoned, Hell-like compound where they are forced to participate in a violent game, the goal of which is to survive twelve hours against a gang of sadistic clowns.",Rob Zombie,2016,102,10871,35,5.1
Final Girl,A man teaches a young woman how to become a complete weapon. Later she is approached by a group of sadistic teens who kill blonde women for unknown reasons. The hunting season begins.,Tyler Shields,2015,90,9026,56,4.7
Chalk It Up,"When a super girly-girl is dumped by her boyfriend; she decides to do everything she can to get him back by building a college gymnastics team, quickly learning that she is capable of a lot more than just getting an MRS degree.",Hisonni Johnson,2016,90,499,,4.8
The Man Who Knew Infinity,"The story of the life and academic career of the pioneer Indian mathematician, Srinivasa Ramanujan, and his friendship with his mentor, Professor G.H. Hardy.",Matt Brown,2015,108,29912,,7.2
Unknown,"A man awakens from a coma, only to discover that someone has taken on his identity and that no one, (not even his wife), believes him. With the help of a young woman, he sets out to prove who he is.",Jaume Collet-Serra,2011,113,218679,56,6.9
Self/less,"A dying real estate mogul transfers his consciousness into a healthy young body, but soon finds that neither the procedure nor the company that performed it are quite what they seem.",Tarsem Singh,2015,117,67196,34,6.5
Mr. Brooks,A psychological thriller about a man who is sometimes controlled by his murder-and-mayhem-loving alter ego.,Bruce A. Evans,2007,120,128146,45,7.3
Tramps,A young man and woman find love in an unlikely place while carrying out a shady deal.,Adam Leon,2016,82,1031,77,6.5
Before We Go,Two strangers stuck in Manhattan for the night grow into each other's most trusted confidants when an evening of unexpected adventure forces them to confront their fears and take control of their lives.,Chris Evans,2014,95,31370,31,6.9
Captain Phillips,"The true story of Captain Richard Phillips and the 2009 hijacking by Somali pirates of the U.S.-flagged MV Maersk Alabama, the first American cargo ship to be hijacked in two hundred years.",Paul Greengrass,2013,134,346154,83,7.8
The Secret Scripture,A woman keeps a diary of her extended stay at a mental hospital.,Jim Sheridan,2016,108,378,37,6.8
Max Steel,"The adventures of teenager Max McGrath and his alien companion, Steel, who must harness and combine their tremendous new powers to evolve into the turbo-charged superhero Max Steel.",Stewart Hendler,2016,92,11555,22,4.6
Hotel Transylvania 2,"Dracula and his friends try to bring out the monster in his half human, half vampire grandson in order to keep Mavis from leaving the hotel.",Genndy Tartakovsky,2015,89,69157,44,6.7
Hancock,Hancock is a superhero whose ill considered behavior regularly causes damage in the millions. He changes when the person he saves helps him improve his public image.,Peter Berg,2008,92,366138,49,6.4
Sisters,Two sisters decide to throw one last house party before their parents sell their family home.,Jason Moore,2015,118,50241,58,6
The Family,"The Manzoni family, a notorious mafia clan, is relocated to Normandy, France under the witness protection program, where fitting in soon becomes challenging as their old habits die hard.",Luc Besson,2013,111,92868,42,6.3
Zack and Miri Make a Porno,"Lifelong platonic friends Zack and Miri look to solve their respective cash-flow problems by making an adult film together. As the cameras roll, however, the duo begin to sense that they may have more feelings for each other than they previously thought.",Kevin Smith,2008,101,154936,56,6.6
Ma vie de Courgette,"After losing his mother, a young boy is sent to a foster home with other orphans his age where he begins to learn the meaning of trust and true love.",Claude Barras,2016,66,4370,85,7.8
Man on a Ledge,"As a police psychologist works to talk down an ex-con who is threatening to jump from a Manhattan hotel rooftop, the biggest diamond heist ever committed is in motion.",Asger Leth,2012,102,129252,40,6.6
No Strings Attached,"A guy and girl try to keep their relationship strictly physical, but it's not long before they learn that they want something more.",Ivan Reitman,2011,108,178243,50,6.2
Rescue Dawn,A U.S. fighter pilot's epic struggle of survival after being shot down on a mission over Laos during the Vietnam War.,Werner Herzog,2006,120,87887,77,7.3
Despicable Me 2,"When Gru, the world's most super-bad turned super-dad has been recruited by a team of officials to stop lethal muscle and a host of Gru's own, He has to fight back with new gadgetry, cars, and more minion madness.",Pierre Coffin,2013,98,304837,62,7.4
A Walk Among the Tombstones,Private investigator Matthew Scudder is hired by a drug kingpin to find out who kidnapped and murdered his wife.,Scott Frank,2014,114,93883,57,6.5
The World's End,Five friends who reunite in an attempt to top their epic pub crawl from twenty years earlier unwittingly become humanity's only hope for survival.,Edgar Wright,2013,109,199813,81,7
Yoga Hosers,Two teenage yoga enthusiasts team up with a legendary man-hunter to battle with an ancient evil presence that is threatening their major party plans.,Kevin Smith,2016,88,7091,23,4.3
Seven Psychopaths,A struggling screenwriter inadvertently becomes entangled in the Los Angeles criminal underworld after his oddball friends kidnap a gangster's beloved Shih Tzu.,Martin McDonagh,2012,110,196652,66,7.2
Beowulf,"The warrior Beowulf must fight and defeat the monster Grendel who is terrorizing Denmark, and later, Grendel's mother, who begins killing out of revenge.",Robert Zemeckis,2007,115,146566,59,6.2
Jack Ryan: Shadow Recruit,"Jack Ryan, as a young covert CIA analyst, uncovers a Russian plot to crash the U.S. economy with a terrorist attack.",Kenneth Branagh,2014,105,103681,57,6.2
1408,"A man who specializes in debunking paranormal occurrences checks into the fabled room 1408 in the Dolphin Hotel. Soon after settling in, he confronts genuine terror.",Mikael Håfström,2007,104,221073,64,6.8
The Gambler,Lit professor and gambler Jim Bennett's debt causes him to borrow money from his mother and a loan shark. Further complicating his situation is his relationship with one of his students. Will Bennett risk his life for a second chance?,Rupert Wyatt,2014,111,52537,55,6
Prince of Persia: The Sands of Time,A young fugitive prince and princess must stop a villain who unknowingly threatens to destroy the world with a special dagger that enables the magic sand inside to reverse time.,Mike Newell,2010,116,233148,50,6.6
The Spectacular Now,"A hard-partying high school senior's philosophy on life changes when he meets the not-so-typical ""nice girl.""",James Ponsoldt,2013,95,115751,82,7.1
A United Kingdom,"The story of King Seretse Khama of Botswana and how his loving but controversial marriage to a British white woman, Ruth Williams, put his kingdom into political and diplomatic turmoil.",Amma Asante,2016,111,4771,65,6.8
USS Indianapolis: Men of Courage,"During World War II, an American navy ship is sunk by a Japanese submarine leaving 300 crewmen stranded in shark infested waters.",Mario Van Peebles,2016,128,4964,30,5.2
Turbo Kid,"In a post-apocalyptic wasteland in 1997, a comic book fan adopts the persona of his favourite hero to save his enthusiastic friend and fight a tyrannical overlord.",François Simard,2015,93,19309,60,6.7
Mama,A young couple take in their two nieces only to suspect that a foreboding evil has latched itself to their family.,Andrés Muschietti,2013,100,142560,57,6.2
Orphan,A husband and wife who recently lost their baby adopt a nine year-old girl who is not nearly as innocent as she claims to be.,Jaume Collet-Serra,2009,123,153448,42,7
To Rome with Love,"The lives of some visitors and residents of Rome and the romances, adventures and predicaments they get into.",Woody Allen,2012,112,72050,54,6.3
Fantastic Mr. Fox,An urbane fox cannot resist returning to his farm raiding ways and then must help his community survive the farmers' retaliation.,Wes Anderson,2009,87,149779,83,7.8
Inside Man,"A police detective, a bank robber, and a high-power broker enter high-stakes negotiations after the criminal's brilliant heist spirals into a hostage situation.",Spike Lee,2006,129,285441,76,7.6
I.T.,"A self-proclaimed millionaire, has his life turned upside down after firing his I.T. consultant.",John Moore,2016,95,8755,27,5.4
127 Hours,"An adventurous mountain climber becomes trapped under a boulder while canyoneering alone near Moab, Utah and resorts to desperate measures in order to survive.",Danny Boyle,2010,94,294010,82,7.6
Annabelle,A couple begins to experience terrifying supernatural occurrences involving a vintage doll shortly after their home is invaded by satanic cultists.,John R. Leonetti,2014,99,91106,37,5.4
Wolves at the Door,"Four friends gather at an elegant home during the Summer of Love, 1969. Unbeknownst to them, deadly visitors are waiting outside. What begins as a simple farewell party turns to a night of ... See full summary »",John R. Leonetti,2016,73,564,63,4.6
Suite Française,"During the early years of Nazi occupation of France in World War II, romance blooms between Lucile Angellier (Michelle Williams), a French villager, and Bruno von Falk (Matthias Schoenaerts), a German soldier.",Saul Dibb,2014,107,13711,,6.9
The Imaginarium of Doctor Parnassus,A traveling theater company gives its audience much more than they were expecting.,Terry Gilliam,2009,123,130153,65,6.8
G.I. Joe: The Rise of Cobra,"An elite military unit comprised of special operatives known as G.I. Joe, operating out of The Pit, takes on an evil organization led by a notorious arms dealer.",Stephen Sommers,2009,118,180105,32,5.8
Christine,"The story of Christine Chubbuck, a 1970s TV reporter struggling with depression and professional frustrations as she tries to advance her career.",Antonio Campos,2016,119,5855,72,7
Man Down,"In a post-apocalyptic America, former U.S. Marine Gabriel Drummer searches desperately for the whereabouts of his son, accompanied by his best friend and a survivor.",Dito Montiel,2015,90,4779,27,5.8
Crawlspace,A thriller centered around a widower who moves into a seemingly perfect new home with his daughter and new wife.,Phil Claydon,2016,88,1427,25,5.3
Shut In,"A heart-pounding thriller about a widowed child psychologist who lives in an isolated existence in rural New England. Caught in a deadly winter storm, she must find a way to rescue a young boy before he disappears forever.",Farren Blackburn,2016,91,5715,,4.6
The Warriors Gate,A teenager is magically transported to China and learns to convert his video game skills into those of a Kung Fu warrior.,Matthias Hoene,2016,108,1391,77,5.3
Grindhouse,Quentin Tarantino and Robert Rodriguez's homage to exploitation double features in the 60s and 70s with two back-to-back cult films that include previews of coming attractions between them.,Robert Rodriguez,2007,191,160350,,7.6
Disaster Movie,"Over the course of one evening, an unsuspecting group of twenty-somethings find themselves bombarded by a series of natural disasters and catastrophic events.",Jason Friedberg,2008,87,77207,15,1.9
Rocky Balboa,"Thirty years after the ring of the first bell, Rocky Balboa comes out of retirement and dons his gloves for his final fight; against the reigning heavyweight champ Mason 'The Line' Dixon.",Sylvester Stallone,2006,102,171356,63,7.2
Diary of a Wimpy Kid: Dog Days,"School's out. Summer vacation is on. However, Greg may not have the best summer vacation ever. What could go wrong?",David Bowers,2012,94,16917,54,6.4
Jane Eyre,A mousy governess who softens the heart of her employer soon discovers that he's hiding a terrible secret.,Cary Joji Fukunaga,2011,120,67464,76,7.4
Fool's Gold,A new clue to the whereabouts of a lost treasure rekindles a married couple's sense of adventure -- and their estranged romance.,Andy Tennant,2008,112,62719,29,5.7
The Dictator,The heroic story of a dictator who risked his life to ensure that democracy would never come to the country he so lovingly oppressed.,Larry Charles,2012,83,225394,58,6.4
