Title,Description,Director,Year,Runtime (Minutes),Votes,Metascore,Rating
The Grand Budapest Hotel,"The adventures of Gustave H, a legendary concierge at a famous hotel from the fictional Republic of Zubrowka between the first and second World Wars, and Zero Moustafa, the lobby boy who becomes his most trusted friend.",Wes Anderson,2014,99,530881,88,8.1
The Host,"When an unseen enemy threatens mankind by taking over their bodies and erasing their memories, Melanie will risk everything to protect the people she cares most about, proving that love can conquer all in a dangerous new world.",Andrew Niccol,2013,125,96852,35,5.9
Fury,"A grizzled tank commander makes tough decisions as he and his crew fight their way across Germany in April, 1945.",David Ayer,2014,134,332234,64,7.6
Inside Out,"After young Riley is uprooted from her Midwest life and moved to San Francisco, her emotions - Joy, Fear, Anger, Disgust and Sadness - conflict on how best to navigate a new city, house, and school.",Pete Docter,2015,95,416689,94,8.2
Rock Dog,"When a radio falls from the sky into the hands of a wide-eyed Tibetan Mastiff, he leaves home to fulfill his dream of becoming a musician, setting into motion a series of completely unexpected events.",Ash Brannon,2016,90,1109,48,5.8
Terminator Genisys,"When John Connor, leader of the human resistance, sends Sgt. Kyle Reese back to 1984 to protect Sarah Connor and safeguard the future, an unexpected turn of events creates a fractured timeline.",Alan Taylor,2015,126,205365,38,6.5
Percy Jackson & the Olympians: The Lightning Thief,A teenager discovers he's the descendant of a Greek god and sets out on an adventure to settle an on-going battle between the gods.,Chris Columbus,2010,118,148949,47,5.9
Les Misérables,"In 19th-century France, Jean Valjean, who for decades has been hunted by the ruthless policeman Javert after breaking parole, agrees to care for a factory worker's daughter. The decision changes their lives forever.",Tom Hooper,2012,158,257426,63,7.6
Children of Men,"In 2027, in a chaotic world in which women have become somehow infertile, a former activist agrees to help transport a miraculously pregnant woman to a sanctuary at sea.",Alfonso Cuarón,2006,109,382910,84,7.9
20th Century Women,"The story of a teenage boy, his mother, and two other women who help raise him among the love and freedom of Southern California of 1979.",Mike Mills,2016,119,14708,83,7.4
Spy,"A desk-bound CIA analyst volunteers to go undercover to infiltrate the world of a deadly arms dealer, and prevent diabolical global disaster.",Paul Feig,2015,119,188017,75,7.1
The Intouchables,"After he becomes a quadriplegic from a paragliding accident, an aristocrat hires a young man from the projects to be his caregiver.",Olivier Nakache,2011,112,557965,57,8.6
Bonjour Anne,"Anne is at a crossroads in her life. Long married to a successful, driven but inattentive movie producer, she unexpectedly finds herself taking a car trip from Cannes to Paris with a ... See full summary »",Eleanor Coppola,2016,92,178,50,4.9
Kynodontas,"Three teenagers live isolated, without leaving their house, because their over-protective parents say they can only leave when their dogtooth falls out.",Yorgos Lanthimos,2009,94,50946,73,7.3
Straight Outta Compton,"The group NWA emerges from the mean streets of Compton in Los Angeles, California, in the mid-1980s and revolutionizes Hip Hop culture with their music and tales about life in the hood.",F. Gary Gray,2015,147,139831,72,7.9
The Amazing Spider-Man 2,"When New York is put under siege by Oscorp, it is up to Spider-Man to save the city he swore to protect as well as his loved ones.",Marc Webb,2014,142,342183,53,6.7
The Conjuring,Paranormal investigators Ed and Lorraine Warren work to help a family terrorized by a dark presence in their farmhouse.,James Wan,2013,112,330305,68,7.5
The Hangover,"Three buddies wake up from a bachelor party in Las Vegas, with no memory of the previous night and the bachelor missing. They make their way around the city in order to find their friend before his wedding.",Todd Phillips,2009,100,611563,73,7.8
Battleship,A fleet of ships is forced to do battle with an armada of unknown origins in order to discover and thwart their destructive goals.,Peter Berg,2012,131,210349,41,5.8
Rise of the Planet of the Apes,"A substance, designed to help the brain repair itself, gives rise to a super-intelligent chimp who leads an ape uprising.",Rupert Wyatt,2011,105,422290,68,7.6
Lights Out,"Rebecca must unlock the terror behind her little brother's experiences that once tested her sanity, bringing her face to face with an entity attached to their mother.",David F. Sandberg,2016,81,69823,58,6.4
Norman: The Moderate Rise and Tragic Fall of a New York Fixer,"Norman Oppenheimer is a small time operator who befriends a young politician at a low point in his life. Three years later, when the politician becomes an influential world leader, Norman's life dramatically changes for better and worse.",Joseph Cedar,2016,118,664,76,7.1
Birdman or (The Unexpected Virtue of Ignorance),"Illustrated upon the progress of his latest Broadway play, a former popular actor's struggle to cope with his current life as a wasted actor is shown.",Alejandro González Iñárritu,2014,119,440299,88,7.8
Black Swan,"A committed dancer wins the lead role in a production of Tchaikovsky's ""Swan Lake"" only to find herself struggling to maintain her sanity.",Darren Aronofsky,2010,108,581518,79,8
Dear White People,The lives of four black students at an Ivy League college.,Justin Simien,2014,108,21715,79,6.2
Nymphomaniac: Vol. I,A self-diagnosed nymphomaniac recounts her erotic experiences to the man who saved her after a beating.,Lars von Trier,2013,117,90556,64,7
Teenage Mutant Ninja Turtles: Out of the Shadows,"After facing Shredder, who has joined forces with mad scientist Baxter Stockman and henchmen Bebop and Rocksteady to take over the world, the Turtles must confront an even greater nemesis: the notorious Krang.",Dave Green,2016,112,59312,40,6
Knock Knock,"A devoted father helps two stranded young women who knock on his door, but his kind gesture turns into a dangerous seduction and a deadly game of cat and mouse.",Eli Roth,2015,99,53441,53,4.9
Dirty Grandpa,"Right before his wedding, an uptight guy is tricked into driving his grandfather, a lecherous former Army Lieutenant-Colonel, to Florida for spring break.",Dan Mazer,2016,102,75137,18,6
Cloud Atlas,"An exploration of how the actions of individual lives impact one another in the past, present and future, as one soul is shaped from a killer into a hero, and an act of kindness ripples across centuries to inspire a revolution.",Tom Tykwer,2012,172,298651,55,7.5
X-Men Origins: Wolverine,"A look at Wolverine's early life, in particular his time with the government squad Team X and the impact it will have on his later years.",Gavin Hood,2009,107,388447,40,6.7
Satanic,"Four friends on their way to Coachella stop off in Los Angeles to tour true-crime occult sites, only to encounter a mysterious young runaway who puts them on a terrifying path to ultimate horror.",Jeffrey G. Hunt,2016,85,2384,,3.7
Skyfall,"Bond's loyalty to M is tested when her past comes back to haunt her. Whilst MI6 comes under attack, 007 must track down and destroy the threat, no matter how personal the cost.",Sam Mendes,2012,143,547386,81,7.8
The Hobbit: An Unexpected Journey,"A reluctant hobbit, Bilbo Baggins, sets out to the Lonely Mountain with a spirited group of dwarves to reclaim their mountain home - and the gold within it - from the dragon Smaug.",Peter Jackson,2012,169,668651,58,7.9
21 Jump Street,A pair of underachieving cops are sent back to a local high school to blend in and bring down a synthetic drug ring.,Phil Lord,2012,110,432046,69,7.2
Sing Street,A boy growing up in Dublin during the 1980s escapes his strained family life by starting a band to impress the mysterious girl he likes.,John Carney,2016,106,52144,79,8
Ballerina,"An orphan girl dreams of becoming a ballerina and flees her rural Brittany for Paris, where she passes for someone else and accedes to the position of pupil at the Grand Opera house.",Eric Summer,2016,89,4729,,6.8
Oblivion,A veteran assigned to extract Earth's remaining resources begins to question what he knows about his mission and himself.,Joseph Kosinski,2013,124,410125,54,7
22 Jump Street,"After making their way through high school (twice), big changes are in store for officers Schmidt and Jenko when they go deep undercover at a local college.",Phil Lord,2014,112,280110,71,7.1
Zodiac,"In the late 1960s/early 1970s, a San Francisco cartoonist becomes an amateur detective obsessed with tracking down the Zodiac Killer, an unidentified individual who terrorizes Northern California with a killing spree.",David Fincher,2007,157,329683,78,7.7
Everybody Wants Some!!,"In 1980, a group of college baseball players navigate their way through the freedoms and responsibilities of unsupervised adulthood.",Richard Linklater,2016,117,36312,83,7
Iron Man Three,"When Tony Stark's world is torn apart by a formidable terrorist called the Mandarin, he starts an odyssey of rebuilding and retribution.",Shane Black,2013,130,591023,62,7.2
Now You See Me,An FBI agent and an Interpol detective track a team of illusionists who pull off bank heists during their performances and reward their audiences with the money.,Louis Leterrier,2013,115,492324,50,7.3
Sherlock Holmes,Detective Sherlock Holmes and his stalwart partner Watson engage in a battle of wits and brawn with a nemesis whose plot is a threat to all of England.,Guy Ritchie,2009,128,501769,57,7.6
Death Proof,"Two separate sets of voluptuous women are stalked at different times by a scarred stuntman who uses his ""death proof"" cars to execute his murderous plans.",Quentin Tarantino,2007,113,220236,,7.1
The Danish Girl,A fictitious love story loosely inspired by the lives of Danish artists Lili Elbe and Gerda Wegener. Lili and Gerda's marriage and work evolve as they navigate Lili's groundbreaking journey as a transgender pioneer.,Tom Hooper,2015,119,110773,66,7
Hercules,"Having endured his legendary twelve labors, Hercules, the Greek demigod, has his life as a sword-for-hire tested when the King of Thrace and his daughter seek his aid in defeating a tyrannical warlord.",Brett Ratner,2014,98,122838,47,6
Sucker Punch,"A young girl is institutionalized by her abusive stepfather, retreating to an alternative reality as a coping strategy, envisioning a plan to help her escape.",Zack Snyder,2011,110,204874,33,6.1
Keeping Up with the Joneses,A suburban couple becomes embroiled in an international espionage plot when they discover that their seemingly perfect new neighbors are government spies.,Greg Mottola,2016,105,30405,34,5.8
Jupiter Ascending,A young woman discovers her destiny as an heiress of intergalactic nobility and must fight to protect the inhabitants of Earth from an ancient and destructive industry.,Lana Wachowski,2015,127,150121,40,5.3
Masterminds,A guard at an armored car company in the Southern U.S. organizes one of the biggest bank heists in American history. Based on the October 1997 Loomis Fargo robbery.,Jared Hess,2016,95,26508,47,5.8
Iris,"Iris, young wife of a businessman, disappears in Paris. Maybe a mechanic with many debts is involved in the strange affair. A really complicated job for the police.",Jalil Lespert,2016,99,726,,6.1
Busanhaeng,"While a zombie virus breaks out in South Korea, passengers struggle to survive on the train from Seoul to Busan.",Sang-ho Yeon,2016,118,58782,72,7.5
Pitch Perfect,"Beca, a freshman at Barden University, is cajoled into joining The Bellas, her school's all-girls singing group. Injecting some much needed energy into their repertoire, The Bellas take on their male rivals in a campus competition.",Jason Moore,2012,112,226631,66,7.2
Neighbors 2: Sorority Rising,"When their new next-door neighbors turn out to be a sorority even more debaucherous than the fraternity previously living there, Mac and Kelly team with their former enemy, Teddy, to bring the girls down.",Nicholas Stoller,2016,92,76327,58,5.7
The Exception,"A German soldier tries to determine if the Dutch resistance has planted a spy to infiltrate the home of Kaiser Wilhelm in Holland during the onset of World War II, but falls for a young Jewish Dutch woman during his investigation.",David Leveaux,2016,107,96,,7.7
Man of Steel,"Clark Kent, one of the last of an extinguished race disguised as an unremarkable human, is forced to reveal his identity when Earth is invaded by an army of survivors who threaten to bring the planet to the brink of destruction.",Zack Snyder,2013,143,577010,55,7.1
The Choice,Travis and Gabby first meet as neighbors in a small coastal town and wind up in a relationship that is tested by life's most defining events.,Ross Katz,2016,111,20514,26,6.6
Ice Age: Collision Course,"Manny, Diego, and Sid join up with Buck to fend off a meteor strike that would destroy the world.",Mike Thurmeier,2016,94,34523,34,5.7
The Devil Wears Prada,"A smart but sensible new graduate lands a job as an assistant to Miranda Priestly, the demanding editor-in-chief of a high fashion magazine.",David Frankel,2006,109,302268,62,6.8
The Infiltrator,A U.S. Customs official uncovers a money laundering scheme involving Colombian drug lord Pablo Escobar.,Brad Furman,2016,127,43929,66,7.1
There Will Be Blood,"A story of family, religion, hatred, oil and madness, focusing on a turn-of-the-century prospector in the early days of the business.",Paul Thomas Anderson,2007,158,400682,92,8.1
The Equalizer,"A man believes he has put his mysterious past behind him and has dedicated himself to beginning a new, quiet life. But when he meets a young girl under the control of ultra-violent Russian gangsters, he can't stand idly by - he has to help her.",Antoine Fuqua,2014,132,249425,57,7.2
Lone Survivor,"Marcus Luttrell and his team set out on a mission to capture or kill notorious Taliban leader Ahmad Shah, in late June 2005. Marcus and his team are left to fight for their lives in one of the most valiant efforts of modern warfare.",Peter Berg,2013,121,218996,60,7.5
The Cabin in the Woods,"Five friends go for a break at a remote cabin, where they get more than they bargained for, discovering the truth behind the cabin in the woods.",Drew Goddard,2012,95,295554,72,7
The House Bunny,"After Playboy bunny Shelley is kicked out of the playboy mansion, she finds a job as the house mother for a sorority full of socially awkward girls.",Fred Wolf,2008,97,67033,55,5.5
She's Out of My League,"An average Joe meets the perfect woman, but his lack of confidence and the influence of his friends and family begin to pick away at the relationship.",Jim Field Smith,2010,104,105619,46,6.4
Inherent Vice,"In 1970, drug-fueled Los Angeles private investigator Larry ""Doc"" Sportello investigates the disappearance of a former girlfriend.",Paul Thomas Anderson,2014,148,69509,81,6.7
Alice Through the Looking Glass,Alice returns to the whimsical world of Wonderland and travels back in time to help the Mad Hatter.,James Bobin,2016,113,57207,34,6.2
Vincent N Roxxy,A small town loner and a rebellious punk rocker unexpectedly fall in love as they are forced on the run and soon discover violence follows them everywhere.,Gary Michael Schultz,2016,110,403,,5.5
The Fast and the Furious: Tokyo Drift,A teenager becomes a major competitor in the world of drift racing after moving in with his father in Tokyo to avoid a jail sentence in America.,Justin Lin,2006,104,193479,45,6
How to Be Single,A group of young adults navigate love and relationships in New York City.,Christian Ditter,2016,110,59886,51,6.1
The Blind Side,"The story of Michael Oher, a homeless and traumatized boy who became an All American football player and first round NFL draft pick with the help of a caring woman and her family.",John Lee Hancock,2009,129,237221,53,7.7
La vie d'Adèle,"Adèle's life is changed when she meets Emma, a young woman with blue hair, who will allow her to discover desire and to assert herself as a woman and as an adult. In front of others, Adèle grows, seeks herself, loses herself, and ultimately finds herself through love and loss.",Abdellatif Kechiche,2013,180,103150,88,7.8
The Babadook,"A single mother, plagued by the violent death of her husband, battles with her son's fear of a monster lurking in the house, but soon discovers a sinister presence all around her.",Jennifer Kent,2014,93,132580,86,6.8
The Hobbit: The Battle of the Five Armies,Bilbo and Company are forced to engage in a war against an array of combatants and keep the Lonely Mountain from falling into the hands of a rising darkness.,Peter Jackson,2014,144,385598,59,7.4
Harry Potter and the Order of the Phoenix,"With their warning about Lord Voldemort's return scoffed at, Harry and Dumbledore are targeted by the Wizard authorities as an authoritarian bureaucrat slowly seizes power at Hogwarts.",David Yates,2007,138,385325,71,7.5
Snowpiercer,"Set in a future where a failed climate-change experiment kills all life on the planet except for a lucky few who boarded the Snowpiercer, a train that travels around the globe, where a class system emerges.",Bong Joon Ho,2013,126,199048,84,7
The 5th Wave,"Four waves of increasingly deadly alien attacks have left most of Earth decimated. Cassie is on the run, desperately trying to save her younger brother.",J Blakeson,2016,112,73093,33,5.2
The Stakelander,"When his home of New Eden is destroyed by a revitalized Brotherhood and its new Vamp leader, Martin finds himself alone in the badlands of America with only the distant memory of his mentor and legendary vampire hunter, Mister, to guide him.",Dan Berk,2016,81,1263,,5.3
The Visit,Two siblings become increasingly frightened by their grandparents' disturbing behavior while visiting them on vacation.,M. Night Shyamalan,2015,94,81429,55,6.2
Fast Five,Dominic Toretto and his crew of street racers plan a massive heist to buy their freedom while in the sights of a powerful Brazilian drug lord and a dangerous federal agent.,Justin Lin,2011,131,300803,66,7.3
Step Up,"Tyler Gage receives the opportunity of a lifetime after vandalizing a performing arts school, gaining him the chance to earn a scholarship and dance with an up and coming dancer, Nora.",Anne Fletcher,2006,104,95960,48,6.5
Lovesong,The relationship between two friends deepens during an impromptu road trip.,So Yong Kim,2016,84,616,74,6.4
RocknRolla,"In London, a real-estate scam puts millions of pounds up for grabs, attracting some of the city's scrappiest tough guys and its more established underworld types, all of whom are looking to get rich quick. While the city's seasoned criminals vie for the cash, an unexpected player -- a drugged-out rock 'n' roller presumed to be dead but very much alive -- has a multi-million-dollar prize fall into... See full summary »",Guy Ritchie,2008,114,203096,53,7.3
In Time,"In a future where people stop aging at 25, but are engineered to live only one more year, having the means to buy your way out of the situation is a shot at immortal youth. Here, Will Salas finds himself accused of murder and on the run with a hostage - a connection that becomes an important part of the way against the system.",Andrew Niccol,2011,109,319025,53,6.7
The Social Network,"Harvard student Mark Zuckerberg creates the social networking site that would become known as Facebook, but is later sued by two brothers who claimed he stole their idea, and the co-founder who was later squeezed out of the business.",David Fincher,2010,120,510100,95,7.7
The Last Witch Hunter,The last witch hunter is all that stands between humanity and the combined forces of the most horrifying witches in history.,Breck Eisner,2015,106,71149,34,6
Victor Frankenstein,"Told from Igor's perspective, we see the troubled young assistant's dark origins, his redemptive friendship with the young medical student Viktor Von Frankenstein, and become eyewitnesses to the emergence of how Frankenstein became the man - and the legend - we know today.",Paul McGuigan,2015,110,37975,36,6
A Street Cat Named Bob,"Based on the international best selling book. The true feel good story of how James Bowen, a busker and recovering drug addict, had his life transformed when he met a stray ginger cat.",Roger Spottiswoode,2016,103,12643,54,7.4
Green Room,A punk rock band is forced to fight for survival after witnessing a murder at a neo-Nazi skinhead bar.,Jeremy Saulnier,2015,95,62885,79,7
Blackhat,A furloughed convict and his American and Chinese partners hunt a high-level cybercrime network from Chicago to Los Angeles to Hong Kong to Jakarta.,Michael Mann,2015,133,43085,51,5.4
Storks,"Storks have moved on from delivering babies to packages. But when an order for a baby appears, the best delivery stork must scramble to fix the error by delivering the baby.",Nicholas Stoller,2016,87,34248,56,6.9
American Sniper,"Navy S.E.A.L. sniper Chris Kyle's pinpoint accuracy saves countless lives on the battlefield and turns him into a legend. Back home to his wife and kids after four tours of duty, however, Chris finds that it is the war he can't leave behind.",Clint Eastwood,2014,133,353305,72,7.3
Dallas Buyers Club,"In 1985 Dallas, electrician and hustler Ron Woodroof works around the system to help AIDS patients get the medication they need after he is diagnosed with the disease.",Jean-Marc Vallée,2013,117,352801,84,8
Lincoln,"As the War continues to rage, America's president struggles with continuing carnage on the battlefield as he fights with many inside his own cabinet on the decision to emancipate the slaves.",Steven Spielberg,2012,150,207497,86,7.4
Rush,The merciless 1970s rivalry between Formula One rivals James Hunt and Niki Lauda.,Ron Howard,2013,123,339722,75,8.1
Before I Wake,A young couple adopt an orphaned child whose dreams - and nightmares - manifest physically as he sleeps.,Mike Flanagan,2016,97,18201,,6.1
Silver Linings Playbook,"After a stint in a mental institution, former teacher Pat Solitano moves back in with his parents and tries to reconcile with his ex-wife. Things get more challenging when Pat meets Tiffany, a mysterious girl with problems of her own.",David O. Russell,2012,122,564364,81,7.8
Tracktown,"A young, talented, and lonely long-distance runner twists her ankle as she prepares for the Olympic Trials and must do something she's never done before: take a day off.",Alexi Pappas,2016,88,115,64,5.9
The Fault in Our Stars,Two teenage cancer patients begin a life-affirming journey to visit a reclusive author in Amsterdam.,Josh Boone,2014,126,271301,69,7.8
Blended,"After a bad blind date, a man and woman find themselves stuck together at a resort for families, where their attraction grows as their respective kids benefit from the burgeoning relationship.",Frank Coraci,2014,117,93764,31,6.5
Fast & Furious,"Brian O'Conner, back working for the FBI in Los Angeles, teams up with Dominic Toretto to bring down a heroin importer by infiltrating his operation.",Justin Lin,2009,107,217464,46,6.6
Looper,"In 2074, when the mob wants to get rid of someone, the target is sent into the past, where a hired gun awaits - someone like Joe - who one day learns the mob wants to 'close the loop' by sending back Joe's future self for assassination.",Rian Johnson,2012,119,452369,84,7.4
White House Down,"While on a tour of the White House with his young daughter, a Capitol policeman springs into action to save his child and protect the president from a heavily armed group of paramilitary invaders.",Roland Emmerich,2013,131,173320,52,6.4
Pete's Dragon,"The adventures of an orphaned boy named Pete and his best friend Elliot, who just so happens to be a dragon.",David Lowery,2016,102,36322,71,6.8
Spider-Man 3,"A strange black entity from another world bonds with Peter Parker and causes inner turmoil as he contends with new villains, temptations, and revenge.",Sam Raimi,2007,139,406219,59,6.2
The Three Musketeers,The hot-headed young D'Artagnan along with three former legendary but now down on their luck Musketeers must unite and defeat a beautiful double agent and her villainous employer from seizing the French throne and engulfing Europe in war.,Paul W.S. Anderson,2011,110,92329,35,5.8
Stardust,"In a countryside town bordering on a magical land, a young man makes a promise to his beloved that he'll retrieve a fallen star by venturing into the magical realm.",Matthew Vaughn,2007,127,220664,66,7.7
American Hustle,"A con man, Irving Rosenfeld, along with his seductive partner Sydney Prosser, is forced to work for a wild FBI agent, Richie DiMaso, who pushes them into a world of Jersey powerbrokers and mafia.",David O. Russell,2013,138,379088,90,7.3
Jennifer's Body,A newly possessed high school cheerleader turns into a succubus who specializes in killing her male classmates. Can her best friend put an end to the horror?,Karyn Kusama,2009,102,96617,47,5.1
Midnight in Paris,"While on a trip to Paris with his fiancée's family, a nostalgic screenwriter finds himself mysteriously going back to the 1920s everyday at midnight.",Woody Allen,2011,94,320323,81,7.7
Lady Macbeth,"Set in 19th century rural England, young bride who has been sold into marriage to a middle-aged man discovers an unstoppable desire within herself as she enters into an affair with a work on her estate.",William Oldroyd,2016,89,1396,83,7.3
Joy,"Joy is the story of the title character, who rose to become founder and matriarch of a powerful family business dynasty.",David O. Russell,2015,124,97679,56,6.6
The Dressmaker,"A glamorous woman returns to her small town in rural Australia. With her sewing machine and haute couture style, she transforms the women and exacts sweet revenge on those who did her wrong.",Jocelyn Moorhouse,2015,119,33352,47,7.1
