Title,Description,Director,Year,Runtime (Minutes),Votes,Metascore,Rating
American Gangster,"In 1970s America, a detective works to bring down the drug empire of Frank Lucas, a heroin kingpin from Manhattan, who is smuggling the drug into the country from the Far East.",Ridley Scott,2007,157,337835,76,7.8
Marie Antoinette,"The retelling of France's iconic but ill-fated queen, Marie Antoinette. From her betrothal and marriage to Louis XVI at 15 to her reign as queen at 19 and to the end of her reign as queen, and ultimately the fall of Versailles.",Sofia Coppola,2006,123,83941,65,6.4
2012,A frustrated writer struggles to keep his family alive when a series of global catastrophes threatens to annihilate mankind.,Roland Emmerich,2009,158,297984,49,5.8
Harry Potter and the Half-Blood Prince,"As Harry Potter begins his sixth year at Hogwarts, he discovers an old book marked as ""the property of the Half-Blood Prince"" and begins to learn more about Lord Voldemort's dark past.",David Yates,2009,153,351059,78,7.5
Argo,"Acting under the cover of a Hollywood producer scouting a location for a science fiction film, a CIA agent launches a dangerous operation to rescue six Americans in Tehran during the U.S. hostage crisis in Iran in 1980.",Ben Affleck,2012,120,481274,86,7.7
Eddie the Eagle,"The story of Eddie Edwards, the notoriously tenacious British underdog ski jumper who charmed the world at the 1988 Winter Olympics.",Dexter Fletcher,2016,106,56332,54,7.4
The Lives of Others,"In 1984 East Berlin, an agent of the secret police, conducting surveillance on a writer and his lover, finds himself becoming increasingly absorbed by their lives.",Florian Henckel von Donnersmarck,2006,137,278103,89,8.5
Pet,"A psychological thriller about a man who bumps into an old crush and subsequently becomes obsessed with her, leading him to hold her captive underneath the animal shelter where he works. ... See full summary »",Carles Torrens,2016,94,8404,48,5.7
Paint It Black,A young woman attempts to deal with the death of her boyfriend while continuously confronted by his mentally unstable mother.,Amber Tamblyn,2016,96,61,71,8.3
Macbeth,"Macbeth, the Thane of Glamis, receives a prophecy from a trio of witches that one day he will become King of Scotland. Consumed by ambition and spurred to action by his wife, Macbeth murders his king and takes the throne for himself.",Justin Kurzel,2015,113,41642,71,6.7
Forgetting Sarah Marshall,"Devastated Peter takes a Hawaiian vacation in order to deal with the recent break-up with his TV star girlfriend, Sarah. Little does he know, Sarah's traveling to the same resort as her ex - and she's bringing along her new boyfriend.",Nicholas Stoller,2008,111,226619,67,7.2
The Giver,"In a seemingly perfect community, without war, pain, suffering, differences or choice, a young boy is chosen to learn from an elderly man about the true pain and pleasure of the ""real"" world.",Phillip Noyce,2014,97,93799,47,6.5
Triple 9,A gang of criminals and corrupt cops plan the murder of a police officer in order to pull off their biggest heist yet across town.,John Hillcoat,2016,115,48400,52,6.3
Perfetti sconosciuti,"Seven long-time friends get together for a dinner. When they decide to share with each other the content of every text message, email and phone call they receive, many secrets start to unveil and the equilibrium trembles.",Paolo Genovese,2016,97,17584,43,7.7
Angry Birds,"Find out why the birds are so angry. When an island populated by happy, flightless birds is visited by mysterious green piggies, it's up to three unlikely outcasts - Red, Chuck and Bomb - to figure out what the pigs are up to.",Clay Kaytis,2016,97,55781,,6.3
Moonrise Kingdom,"A pair of young lovers flee their New England town, which causes a local search party to fan out to find them.",Wes Anderson,2012,94,254446,84,7.8
Hairspray,Pleasantly plump teenager Tracy Turnblad teaches 1962 Baltimore a thing or two about integration after landing a spot on a local TV dance show.,Adam Shankman,2007,117,102954,81,6.7
Safe Haven,"A young woman with a mysterious past lands in Southport, North Carolina where her bond with a widower forces her to confront the dark secret that haunts her.",Lasse Hallström,2013,115,84765,34,6.7
Focus,"In the midst of veteran con man Nicky's latest scheme, a woman from his past - now an accomplished femme fatale - shows up and throws his plans for a loop.",Glenn Ficarra,2015,105,166489,56,6.6
Ratatouille,A rat who can cook makes an unusual alliance with a young kitchen worker at a famous restaurant.,Brad Bird,2007,111,504039,96,8
Stake Land,Martin was a normal teenage boy before the country collapsed in an empty pit of economic and political disaster. A vampire epidemic has swept across what is left of the nation's abandoned ... See full summary »,Jim Mickle,2010,98,36091,66,6.5
The Book of Eli,"A post-apocalyptic tale, in which a lone man fights his way across America in order to protect a sacred book that holds the secrets to saving humankind.",Albert Hughes,2010,118,241359,53,6.9
Cloverfield,A group of friends venture deep into the streets of New York on a rescue mission during a rampaging monster attack.,Matt Reeves,2008,85,313803,64,7
Point Break,"A young FBI agent infiltrates an extraordinary team of extreme sports athletes he suspects of masterminding a string of unprecedented, sophisticated corporate heists.",Ericson Core,2015,114,44553,34,5.3
Under the Skin,"A mysterious young woman seduces lonely men in the evening hours in Scotland. However, events lead her to begin a process of self-discovery.",Jonathan Glazer,2013,108,94707,78,6.3
I Am Legend,"Years after a plague kills most of humanity and transforms the rest into monsters, the sole survivor in New York City struggles valiantly to find a cure.",Francis Lawrence,2007,101,565721,65,7.2
Men in Black 3,Agent J travels in time to M.I.B.'s early days in 1969 to stop an alien from assassinating his friend Agent K and changing history.,Barry Sonnenfeld,2012,106,278379,58,6.8
Super 8,"During the summer of 1979, a group of friends witness a train crash and investigate subsequent unexplained events in their small town.",J.J. Abrams,2011,112,298913,72,7.1
Law Abiding Citizen,A frustrated man decides to take justice into his own hands after a plea bargain sets one of his family's killers free. He targets not only the killer but also the district attorney and others involved in the deal.,F. Gary Gray,2009,109,228339,34,7.4
Up,"Seventy-eight year old Carl Fredricksen travels to Paradise Falls in his home equipped with balloons, inadvertently taking a young stowaway.",Pete Docter,2009,96,722203,88,8.3
Maze Runner: The Scorch Trials,"After having escaped the Maze, the Gladers now face a new set of challenges on the open roads of a desolate landscape filled with unimaginable obstacles.",Wes Ball,2015,131,159364,43,6.3
Carol,An aspiring photographer develops an intimate relationship with an older woman in 1950s New York.,Todd Haynes,2015,118,77995,95,7.2
Imperium,"A young FBI agent, eager to prove himself in the field, goes undercover as a white supremacist.",Daniel Ragussis,2016,109,27428,68,6.5
Youth,A retired orchestra conductor is on holiday with his daughter and his film director best friend in the Alps when he receives an invitation from Queen Elizabeth II to perform for Prince Philip's birthday.,Paolo Sorrentino,2015,124,52636,64,7.3
Mr. Nobody,"A boy stands on a station platform as a train is about to leave. Should he go with his mother or stay with his father? Infinite possibilities arise from this decision. As long as he doesn't choose, anything is possible.",Jaco Van Dormael,2009,141,166872,63,7.9
City of Tiny Lights,"In the teeming, multicultural metropolis of modern-day London, a seemingly straightforward missing-person case launches a down-at-heel private eye into a dangerous world of religious fanaticism and political intrigue.",Pete Travis,2016,110,291,54,5.7
Savages,Pot growers Ben and Chon face off against the Mexican drug cartel who kidnapped their shared girlfriend.,Oliver Stone,2012,131,107960,59,6.5
(500) Days of Summer,"An offbeat romantic comedy about a woman who doesn't believe true love exists, and the young man who falls for her.",Marc Webb,2009,95,398972,76,7.7
Movie 43,A series of interconnected short films follows a washed-up producer as he pitches insane story lines featuring some of the biggest stars in Hollywood.,Elizabeth Banks,2013,94,83625,18,4.3
Gravity,Two astronauts work together to survive after an accident which leaves them alone in space.,Alfonso Cuarón,2013,91,622089,96,7.8
The Boy in the Striped Pyjamas,"Set during WWII, a story seen through the innocent eyes of Bruno, the eight-year-old son of the commandant at a German concentration camp, whose forbidden friendship with a Jewish boy on the other side of the camp fence has startling and unexpected consequences.",Mark Herman,2008,94,144614,55,7.8
Shooter,"A marksman living in exile is coaxed back into action after learning of a plot to kill the President. Ultimately double-crossed and framed for the attempt, he goes on the run to find the real killer and the reason he was set up.",Antoine Fuqua,2007,124,267820,53,7.2
The Happening,"A science teacher, his wife, and a young girl struggle to survive a plague that causes those infected to commit suicide.",M. Night Shyamalan,2008,91,170897,34,5
Bone Tomahawk,Four men set out in the Wild West to rescue a group of captives from cannibalistic cave dwellers.,S. Craig Zahler,2015,132,47289,72,7.1
Magic Mike XXL,"Three years after Mike bowed out of the stripper life at the top of his game, he and the remaining Kings of Tampa hit the road to Myrtle Beach to put on one last blow-out performance.",Gregory Jacobs,2015,115,42506,60,5.7
Easy A,A clean-cut high school student relies on the school's rumor mill to advance her social and financial standing.,Will Gluck,2010,92,294950,72,7.1
Exodus: Gods and Kings,"The defiant leader Moses rises up against the Egyptian Pharaoh Ramses, setting 600,000 slaves on a monumental journey of escape from Egypt and its terrifying cycle of deadly plagues.",Ridley Scott,2014,150,137299,52,6
Chappie,"In the near future, crime is patrolled by a mechanized police force. When one police droid, Chappie, is stolen and given new programming, he becomes the first robot with the ability to think and feel for himself.",Neill Blomkamp,2015,120,188769,41,6.9
The Hobbit: The Desolation of Smaug,"The dwarves, along with Bilbo Baggins and Gandalf the Grey, continue their quest to reclaim Erebor, their homeland, from Smaug. Bilbo Baggins is in possession of a mysterious and magical ring.",Peter Jackson,2013,161,513744,66,7.9
Half of a Yellow Sun,"Sisters Olanna and Kainene return home to 1960s Nigeria, where they soon diverge on different paths. As civil war breaks out, political events loom larger than their differences as they join the fight to establish an independent republic.",Biyi Bandele,2013,111,1356,51,6.2
Anthropoid,"Based on the extraordinary true story of Operation Anthropoid, the WWII mission to assassinate SS General Reinhard Heydrich, the main architect behind the Final Solution and the Reich's third in command after Hitler and Himmler.",Sean Ellis,2016,120,24100,59,7.2
The Counselor,A lawyer finds himself in over his head when he gets involved in drug trafficking.,Ridley Scott,2013,117,84927,48,5.3
Viking,"Kievan Rus, late 10th century. After the death of his father, the young Viking prince Vladimir of Novgorod is forced into exile across the frozen sea.",Andrey Kravchuk,2016,133,1830,57,4.7
Whiskey Tango Foxtrot,A journalist recounts her wartime coverage in Afghanistan.,Glenn Ficarra,2016,112,36156,,6.6
Trust,A teenage girl is targeted by an online sexual predator.,David Schwimmer,2010,106,36043,60,7
Birth of the Dragon,"Young, up-and-coming martial artist, Bruce Lee, challenges legendary kung fu master Wong Jack Man to a no-holds-barred fight in Northern California.",George Nolfi,2016,103,552,61,3.9
Elysium,"In the year 2154, the very wealthy live on a man-made space station while the rest of the population resides on a ruined Earth. A man takes on a mission that could bring equality to the polarized worlds.",Neill Blomkamp,2013,109,358932,,6.6
The Green Inferno,"A group of student activists travels to the Amazon to save the rain forest and soon discover that they are not alone, and that no good deed goes unpunished.",Eli Roth,2013,100,26461,38,5.4
Godzilla,"The world is beset by the appearance of monstrous creatures, but one of them may be the only one who can save humanity.",Gareth Edwards,2014,123,318058,62,6.4
The Bourne Legacy,"An expansion of the universe from Robert Ludlum's novels, centered on a new hero whose stakes have been triggered by the events of the previous three films.",Tony Gilroy,2012,135,245374,61,6.7
A Good Year,"A British investment broker inherits his uncle's chateau and vineyard in Provence, where he spent much of his childhood. He discovers a new laid-back lifestyle as he tries to renovate the estate to be sold.",Ridley Scott,2006,117,74674,47,6.9
Friend Request,"When a college student unfriends a mysterious girl online, she finds herself fighting a demonic presence that wants to make her lonely by killing her closest friends.",Simon Verhoeven,2016,92,12758,59,5.4
Deja Vu,"After a ferry is bombed in New Orleans, an A.T.F. agent joins a unique investigation using experimental surveillance technology to find the bomber, but soon finds himself becoming obsessed with one of the victims.",Tony Scott,2006,126,253858,,7
Lucy,"A woman, accidentally caught in a dark deal, turns the tables on her captors and transforms into a merciless warrior evolved beyond human logic.",Luc Besson,2014,89,352698,61,6.4
A Quiet Passion,"The story of American poet Emily Dickinson from her early days as a young schoolgirl to her later years as a reclusive, unrecognized artist.",Terence Davies,2016,125,1024,77,7.2
Need for Speed,"Fresh from prison, a street racer who was framed by a wealthy business associate joins a cross country race with revenge in mind. His ex-partner, learning of the plan, places a massive bounty on his head as the race begins.",Scott Waugh,2014,132,143389,39,6.5
Jack Reacher,A homicide investigator digs deeper into a case involving a trained military sniper who shot five random victims.,Christopher McQuarrie,2012,130,250811,50,7
The Do-Over,"Two down-on-their-luck guys decide to fake their own deaths and start over with new identities, only to find the people they're pretending to be are in even deeper trouble.",Steven Brill,2016,108,24761,22,5.7
True Crimes,"A murder investigation of a slain business man turns to clues found in an author's book about an eerily similar crime. Based on the 2008 article ""True Crimes - A postmodern murder mystery"" by David Grann.",Alexandros Avranas,2016,92,198,43,7.3
American Pastoral,An All-American college star and his beauty queen wife watch their seemingly perfect life fall apart as their daughter joins the turmoil of '60s America.,Ewan McGregor,2016,108,7115,,6.1
The Ghost Writer,A ghostwriter hired to complete the memoirs of a former British prime minister uncovers secrets that put his own life in jeopardy.,Roman Polanski,2010,128,137964,77,7.2
Limitless,"With the help of a mysterious pill that enables the user to access 100 percent of his brain abilities, a struggling writer becomes a financial wizard, but it also puts him in a new world with lots of dangers.",Neil Burger,2011,105,444417,59,7.4
Spectral,A sci-fi/thriller story centered on a special-ops team that is dispatched to fight supernatural beings.,Nic Mathieu,2016,107,27042,39,6.3
P.S. I Love You,A young widow discovers that her late husband has left her 10 messages intended to help ease her pain and start a new life.,Richard LaGravenese,2007,126,177247,,7.1
Zipper,A successful family man with a blossoming political career loses all sense of morality when he becomes addicted to using an escort agency.,Mora Stephens,2015,103,4912,39,5.7
Midnight Special,"A father and son go on the run, pursued by the government and a cult drawn to the child's special powers.",Jeff Nichols,2016,112,54787,76,6.7
Don't Think Twice,"When a member of a popular New York City improv troupe gets a huge break, the rest of the group - all best friends - start to realize that not everyone is going to make it after all.",Mike Birbiglia,2016,92,10485,83,6.8
Alice in Wonderland,"Nineteen-year-old Alice returns to the magical world from her childhood adventure, where she reunites with her old friends and learns of her true destiny: to end the Red Queen's reign of terror.",Tim Burton,2010,108,324898,53,6.5
Chuck,A drama inspired by the life of heavyweight boxer Chuck Wepner.,Philippe Falardeau,2016,98,391,68,6.8
"I, Daniel Blake","After having suffered a heart-attack, a 59-year-old carpenter must fight the bureaucratic forces of the system in order to receive Employment and Support Allowance.",Ken Loach,2016,100,22941,77,7.9
The Break-Up,"In a bid to keep their luxurious condo from their significant other, a couple's break-up proceeds to get uglier and nastier by the moment.",Peyton Reed,2006,106,106381,45,5.8
Loving,"The story of Richard and Mildred Loving, a couple whose arrest for interracial marriage in 1960s Virginia began a legal battle that would end with the Supreme Court's historic 1967 decision.",Jeff Nichols,2016,123,17141,79,7.1
Fantastic Four,Four young outsiders teleport to an alternate and dangerous universe which alters their physical form in shocking ways. The four must learn to harness their new abilities and work together to save Earth from a former friend turned enemy.,Josh Trank,2015,100,121847,27,4.3
The Survivalist,"In a time of starvation, a survivalist lives off a small plot of land hidden deep in forest. When two women seeking food and shelter discover his farm, he finds his existence threatened.",Stephen Fingleton,2015,104,9187,80,6.3
Colonia,"A young woman's desperate search for her abducted boyfriend that draws her into the infamous Colonia Dignidad, a sect nobody has ever escaped from.",Florian Gallenberger,2015,106,30074,33,7.1
The Boy Next Door,"A woman, separated from her unfaithful husband, falls for a younger man who has moved in next door, but their torrid affair soon takes a dangerous turn.",Rob Cohen,2015,91,30180,30,4.6
The Gift,A young married couple's lives are thrown into a harrowing tailspin when an acquaintance from the husband's past brings mysterious gifts and a horrifying secret to light after more than 20 years.,Joel Edgerton,2015,108,96688,77,7.1
Dracula Untold,"As his kingdom is being threatened by the Turks, young prince Vlad Tepes must become a monster feared by his own people in order to obtain the power needed to protect his own family, and the families of his kingdom.",Gary Shore,2014,92,148504,40,6.3
In the Heart of the Sea,"A recounting of a New England whaling ship's sinking by a giant whale in 1820, an experience that later inspired the great novel Moby-Dick.",Ron Howard,2015,122,90372,47,6.9
Idiocracy,"Private Joe Bauers, the definition of ""average American"", is selected by the Pentagon to be the guinea pig for a top-secret hibernation program. Forgotten, he awakes five centuries in the future. He discovers a society so incredibly dumbed down that he's easily the most intelligent person alive.",Mike Judge,2006,84,115355,66,6.6
The Expendables,A CIA operative hires a team of mercenaries to eliminate a Latin dictator and a renegade CIA agent.,Sylvester Stallone,2010,103,283282,45,6.5
Evil Dead,"Five friends head to a remote cabin, where the discovery of a Book of the Dead leads them to unwittingly summon up demons living in the nearby woods.",Fede Alvarez,2013,91,133113,57,6.5
Sinister,Washed-up true-crime writer Ellison Oswalt finds a box of super 8 home movies that suggest the murder he is currently researching is the work of a serial killer whose work dates back to the 1960s.,Scott Derrickson,2012,110,171169,53,6.8
Wreck-It Ralph,"A video game villain wants to be a hero and sets out to fulfill his dream, but his quest brings havoc to the whole arcade where he lives.",Rich Moore,2012,101,290559,72,7.8
Snow White and the Huntsman,"In a twist to the fairy tale, the Huntsman ordered to take Snow White into the woods to be killed winds up becoming her protector and mentor in a quest to vanquish the Evil Queen.",Rupert Sanders,2012,127,239772,57,6.1
Pan,"12-year-old orphan Peter is spirited away to the magical world of Neverland, where he finds both fun and danger, and ultimately discovers his destiny -- to become the hero who will be forever known as Peter Pan.",Joe Wright,2015,111,47804,36,5.8
Transformers: Dark of the Moon,"The Autobots learn of a Cybertronian spacecraft hidden on the moon, and race against the Decepticons to reach it and to learn its secrets.",Michael Bay,2011,154,338369,42,6.3
Juno,"Faced with an unplanned pregnancy, an offbeat young woman makes an unusual decision regarding her unborn child.",Jason Reitman,2007,96,432461,81,7.5
A Hologram for the King,A failed American sales rep looks to recoup his losses by traveling to Saudi Arabia and selling his company's product to a wealthy monarch.,Tom Tykwer,2016,98,26521,58,6.1
Money Monster,Financial TV host Lee Gates and his producer Patty are put in an extreme situation when an irate investor takes over their studio.,Jodie Foster,2016,98,68654,55,6.5
The Other Woman,"After discovering her boyfriend is married, Carly soon meets the wife he's been betraying. And when yet another love affair is discovered, all three women team up to plot revenge on the three-timing S.O.B.",Nick Cassavetes,2014,109,110825,39,6
Enchanted,"A young maiden in a land called Andalasia, who is prepared to be wed, is sent away to New York City by an evil queen, where she falls in love with a lawyer.",Kevin Lima,2007,107,150353,75,7.1
The Intern,"70-year-old widower Ben Whittaker has discovered that retirement isn't all it's cracked up to be. Seizing an opportunity to get back in the game, he becomes a senior intern at an online fashion site, founded and run by Jules Ostin.",Nancy Meyers,2015,121,159582,51,7.1
Little Miss Sunshine,A family determined to get their young daughter into the finals of a beauty pageant take a cross-country trip in their VW bus.,Jonathan Dayton,2006,101,374044,80,7.8
Bleed for This,"The inspirational story of World Champion Boxer Vinny Pazienza who, after a near fatal car crash which left him not knowing if he'd ever walk again, made one of sport's most incredible comebacks.",Ben Younger,2016,117,11900,62,6.8
Clash of the Titans,"Perseus demigod, son of Zeus, battles the minions of the underworld to stop them from conquering heaven and earth.",Louis Leterrier,2010,106,238206,39,5.8
The Finest Hours,The Coast Guard makes a daring rescue attempt off the coast of Cape Cod after a pair of oil tankers are destroyed during a blizzard in 1952.,Craig Gillespie,2016,117,44425,58,6.8
Tron,The son of a virtual world designer goes looking for his father and ends up inside the digital world that his father designed. He meets his father's corrupted creation and a unique ally who was born inside the digital world.,Joseph Kosinski,2010,125,273959,49,6.8
The Hunger Games: Catching Fire,Katniss Everdeen and Peeta Mellark become targets of the Capitol after their victory in the 74th Hunger Games sparks a rebellion in the Districts of Panem.,Francis Lawrence,2013,146,525646,76,7.6
All Good Things,"Mr. David Marks was suspected but never tried for killing his wife Katie who disappeared in 1982, but the truth is eventually revealed.",Andrew Jarecki,2010,101,44158,57,6.3
Kickboxer: Vengeance,A kick boxer is out to avenge his brother.,John Stockwell,2016,90,6809,37,4.9
The Last Airbender,"Follows the adventures of Aang, a young successor to a long line of Avatars, who must master all four elements and stop the Fire Nation from enslaving the Water Tribes and the Earth Kingdom.",M. Night Shyamalan,2010,103,125129,20,4.2
Sex Tape,"A married couple wake up to discover that the sex tape they made the evening before has gone missing, leading to a frantic search for its whereabouts.",Jake Kasdan,2014,94,89885,36,5.1
What to Expect When You're Expecting,"Follows the lives of five interconnected couples as they experience the thrills and surprises of having a baby, and realize that no matter what you plan for, life does not always deliver what is expected.",Kirk Jones,2012,110,60059,41,5.7
Moneyball,Oakland A's general manager Billy Beane's successful attempt to assemble a baseball team on a lean budget by employing computer-generated analysis to acquire new players.,Bennett Miller,2011,133,297395,87,7.6
Ghost Rider,"Stunt motorcyclist Johnny Blaze gives up his soul to become a hellblazing vigilante, to fight against power hungry Blackheart, the son of the devil himself.",Mark Steven Johnson,2007,114,190673,35,5.2
Unbroken,"After a near-fatal plane crash in WWII, Olympian Louis Zamperini spends a harrowing 47 days in a raft with two fellow crewmen before he's caught by the Japanese navy and sent to a prisoner-of-war camp.",Angelina Jolie,2014,137,114006,59,7.2
Immortals,"Theseus is a mortal man chosen by Zeus to lead the fight against the ruthless King Hyperion, who is on a rampage across Greece to obtain a weapon that can destroy humanity.",Tarsem Singh,2011,110,142900,46,6
Sunshine,A team of international astronauts are sent on a dangerous mission to reignite the dying Sun with a nuclear fission bomb in 2057.,Danny Boyle,2007,107,199860,64,7.3
Brave,"Determined to make her own path in life, Princess Merida defies a custom that brings chaos to her kingdom. Granted one wish, Merida must rely on her bravery and her archery skills to undo a beastly curse.",Mark Andrews,2012,93,293941,69,7.2
