Title,Description,Director,Year,Runtime (Minutes),Votes,Metascore,Rating
Guardians of the Galaxy,A group of intergalactic criminals are forced to work together to stop a fanatical warrior from taking control of the universe.,James Gunn,2014,121,757074,76,8.1
Prometheus,"Following clues to the origin of mankind, a team finds a structure on a distant moon, but they soon realize they are not alone.",Ridley Scott,2012,124,485820,65,7
Split,Three girls are kidnapped by a man with a diagnosed 23 distinct personalities. They must try to escape before the apparent emergence of a frightful new 24th.,M. Night Shyamalan,2016,117,157606,62,7.3
Sing,"In a city of humanoid animals, a hustling theater impresario's attempt to save his theater with a singing competition becomes grander than he anticipates even as its finalists' find that their lives will never be the same.",Christophe Lourdelet,2016,108,60545,59,7.2
Suicide Squad,A secret government agency recruits some of the most dangerous incarcerated super-villains to form a defensive task force. Their first mission: save the world from the apocalypse.,David Ayer,2016,123,393727,40,6.2
The Great Wall,European mercenaries searching for black powder become embroiled in the defense of the Great Wall of China against a horde of monstrous creatures.,Yimou Zhang,2016,103,56036,42,6.1
La La Land,A jazz pianist falls for an aspiring actress in Los Angeles.,Damien Chazelle,2016,128,258682,93,8.3
Mindhorn,"A has-been actor best known for playing the title character in the 1980s detective series ""Mindhorn"" must work with the police when a serial killer says that he will only speak with Detective Mindhorn, whom he believes to be a real person.",Sean Foley,2016,89,2490,71,6.4
The Lost City of Z,"A true-life drama, centering on British explorer Col. Percival Fawcett, who disappeared while searching for a mysterious city in the Amazon in the 1920s.",James Gray,2016,141,7188,78,7.1
Passengers,"A spacecraft traveling to a distant colony planet and transporting thousands of people has a malfunction in its sleep chambers. As a result, two passengers are awakened 90 years early.",Morten Tyldum,2016,116,192177,41,7
Fantastic Beasts and Where to Find Them,The adventures of writer Newt Scamander in New York's secret community of witches and wizards seventy years before Harry Potter reads his book in school.,David Yates,2016,133,232072,66,7.5
Hidden Figures,The story of a team of female African-American mathematicians who served a vital role in NASA during the early years of the U.S. space program.,Theodore Melfi,2016,127,93103,74,7.8
Rogue One,"The Rebel Alliance makes a risky move to steal the plans for the Death Star, setting up the epic saga to follow.",Gareth Edwards,2016,133,323118,65,7.9
Moana,"In Ancient Polynesia, when a terrible curse incurred by the Demigod Maui reaches an impetuous Chieftain's daughter's island, she answers the Ocean's call to seek out the Demigod to set things right.",Ron Clements,2016,107,118151,81,7.7
Colossal,"Gloria is an out-of-work party girl forced to leave her life in New York City, and move back home. When reports surface that a giant creature is destroying Seoul, she gradually comes to the realization that she is somehow connected to this phenomenon.",Nacho Vigalondo,2016,109,8612,70,6.4
The Secret Life of Pets,"The quiet life of a terrier named Max is upended when his owner takes in Duke, a stray whom Max instantly dislikes.",Chris Renaud,2016,87,120259,61,6.6
Hacksaw Ridge,"WWII American Army Medic Desmond T. Doss, who served during the Battle of Okinawa, refuses to kill people, and becomes the first man in American history to receive the Medal of Honor without firing a shot.",Mel Gibson,2016,139,211760,71,8.2
Jason Bourne,The CIA's most dangerous former operative is drawn out of hiding to uncover more explosive truths about his past.,Paul Greengrass,2016,123,150823,58,6.7
Lion,"A five-year-old Indian boy gets lost on the streets of Calcutta, thousands of kilometers from home. He survives many challenges before being adopted by a couple in Australia. 25 years later, he sets out to find his lost family.",Garth Davis,2016,118,102061,69,8.1
Arrival,"When twelve mysterious spacecraft appear around the world, linguistics professor Louise Banks is tasked with interpreting the language of the apparent alien visitors.",Denis Villeneuve,2016,116,340798,81,8
Gold,"Kenny Wells, a prospector desperate for a lucky break, teams up with a similarly eager geologist and sets off on a journey to find gold in the uncharted jungle of Indonesia.",Stephen Gaghan,2016,120,19053,49,6.7
Manchester by the Sea,A depressed uncle is asked to take care of his teenage nephew after the boy's father dies.,Kenneth Lonergan,2016,137,134213,96,7.9
Hounds of Love,"A cold-blooded predatory couple while cruising the streets in search of their next victim, will stumble upon a 17-year-old high school girl, who will be sedated, abducted and chained in the strangers' guest room.",Ben Young,2016,108,1115,72,6.7
Trolls,"After the Bergens invade Troll Village, Poppy, the happiest Troll ever born, and the curmudgeonly Branch set off on a journey to rescue her friends.",Walt Dohrn,2016,92,38552,56,6.5
Independence Day: Resurgence,"Two decades after the first Independence Day invasion, Earth is faced with a new extra-Solar threat. But will mankind's new space defenses be enough?",Roland Emmerich,2016,120,127553,32,5.3
Paris pieds nus,"Fiona visits Paris for the first time to assist her myopic Aunt Martha. Catastrophes ensue, mainly involving Dom, a homeless man who has yet to have an emotion or thought he was afraid of expressing.",Dominique Abel,2016,83,222,,6.8
Bahubali: The Beginning,"In ancient India, an adventurous and daring man becomes involved in a decades old feud between two warring people.",S.S. Rajamouli,2015,159,76193,,8.3
Dead Awake,A young woman must save herself and her friends from an ancient evil that stalks its victims through the real-life phenomenon of sleep paralysis.,Phillip Guzman,2016,99,523,,4.7
Bad Moms,"When three overworked and under-appreciated moms are pushed beyond their limits, they ditch their conventional responsibilities for a jolt of long overdue freedom, fun, and comedic self-indulgence.",Jon Lucas,2016,100,66540,60,6.2
Assassin's Creed,"When Callum Lynch explores the memories of his ancestor Aguilar and gains the skills of a Master Assassin, he discovers he is a descendant of the secret Assassins society.",Justin Kurzel,2016,115,112813,36,5.9
Why Him?,A holiday gathering threatens to go off the rails when Ned Fleming realizes that his daughter's Silicon Valley millionaire boyfriend is about to pop the question.,John Hamburg,2016,111,48123,39,6.3
Nocturnal Animals,"A wealthy art gallery owner is haunted by her ex-husband's novel, a violent thriller she interprets as a symbolic revenge tale.",Tom Ford,2016,116,126030,67,7.5
X-Men: Apocalypse,"After the re-emergence of the world's first mutant, world-destroyer Apocalypse, the X-Men must unite to defeat his extinction level plan.",Bryan Singer,2016,144,275510,52,7.1
Deadpool,A fast-talking mercenary with a morbid sense of humor is subjected to a rogue experiment that leaves him with accelerated healing powers and a quest for revenge.,Tim Miller,2016,108,627797,65,8
Resident Evil: The Final Chapter,"Alice returns to where the nightmare began: The Hive in Raccoon City, where the Umbrella Corporation is gathering its forces for a final strike against the only remaining survivors of the apocalypse.",Paul W.S. Anderson,2016,107,46165,49,5.6
Captain America: Civil War,Political interference in the Avengers' activities causes a rift between former allies Captain America and Iron Man.,Anthony Russo,2016,147,411656,75,7.9
Interstellar,A team of explorers travel through a wormhole in space in an attempt to ensure humanity's survival.,Christopher Nolan,2014,169,1047747,74,8.6
Doctor Strange,"While on a journey of physical and spiritual healing, a brilliant neurosurgeon is drawn into the world of the mystic arts.",Scott Derrickson,2016,115,293732,72,7.6
The Magnificent Seven,Seven gunmen in the old west gradually come together to help a poor village against savage thieves.,Antoine Fuqua,2016,132,122853,54,6.9
5/25/77,"Alienated, hopeful-filmmaker Pat Johnson's epic story growing up in rural Illinois, falling in love, and becoming the first fan of the movie that changed everything.",Patrick Read Johnson,2007,113,241,,7.1
Sausage Party,A sausage strives to discover the truth about his existence.,Greg Tiernan,2016,89,120690,66,6.3
Moonlight,"A chronicle of the childhood, adolescence and burgeoning adulthood of a young, African-American, gay man growing up in a rough neighborhood of Miami.",Barry Jenkins,2016,111,135095,99,7.5
Don't Fuck in the Woods,"A group of friends are going on a camping trip to celebrate graduating college. But once they enter the woods, the proverbial shit starts to hit the fan.",Shawn Burkett,2016,73,496,,2.7
The Founder,"The story of Ray Kroc, a salesman who turned two brothers' innovative fast food eatery, McDonald's, into one of the biggest restaurant businesses in the world with a combination of ambition, persistence, and ruthlessness.",John Lee Hancock,2016,115,37033,66,7.2
Lowriders,"A young street artist in East Los Angeles is caught between his father's obsession with lowrider car culture, his ex-felon brother and his need for self-expression.",Ricardo de Montreuil,2016,99,279,57,6.3
Pirates of the Caribbean: On Stranger Tides,"Jack Sparrow and Barbossa embark on a quest to find the elusive fountain of youth, only to discover that Blackbeard and his daughter are after it too.",Rob Marshall,2011,136,395025,45,6.7
Miss Sloane,"In the high-stakes world of political power-brokers, Elizabeth Sloane is the most sought after and formidable lobbyist in D.C. But when taking on the most powerful opponent of her career, she finds winning may come at too high a price.",John Madden,2016,132,17818,64,7.3
Fallen,"A young girl finds herself in a reform school after therapy since she was blamed for the death of a young boy. At the school she finds herself drawn to a fellow student, unaware that he is an angel, and has loved her for thousands of years.",Scott Hicks,2016,91,5103,,5.6
Star Trek Beyond,"The USS Enterprise crew explores the furthest reaches of uncharted space, where they encounter a new ruthless enemy who puts them and everything the Federation stands for to the test.",Justin Lin,2016,122,164567,68,7.1
The Last Face,"A director (Charlize Theron) of an international aid agency in Africa meets a relief aid doctor (Javier Bardem) amidst a political/social revolution, and together face tough choices ... See full summary »",Sean Penn,2016,130,987,16,3.7
Star Wars: Episode VII - The Force Awakens,"Three decades after the defeat of the Galactic Empire, a new threat arises. The First Order attempts to rule the galaxy and only a ragtag group of heroes can stop them, along with the help of the Resistance.",J.J. Abrams,2015,136,661608,81,8.1
Underworld: Blood Wars,"Vampire death dealer, Selene (Kate Beckinsale) fights to end the eternal war between the Lycan clan and the Vampire faction that betrayed her.",Anna Foerster,2016,91,41362,23,5.8
Mother's Day,Three generations come together in the week leading up to Mother's Day.,Garry Marshall,2016,118,20221,18,5.6
John Wick,An ex-hitman comes out of retirement to track down the gangsters that took everything from him.,Chad Stahelski,2014,101,321933,68,7.2
The Dark Knight,"When the menace known as the Joker wreaks havoc and chaos on the people of Gotham, the Dark Knight must come to terms with one of the greatest psychological tests of his ability to fight injustice.",Christopher Nolan,2008,152,1791916,82,9
Silence,"In the 17th century, two Portuguese Jesuit priests travel to Japan in an attempt to locate their mentor, who is rumored to have committed apostasy, and to propagate Catholicism.",Martin Scorsese,2016,161,49190,79,7.3
Don't Breathe,"Hoping to walk away with a massive fortune, a trio of thieves break into the house of a blind man who isn't as helpless as he seems.",Fede Alvarez,2016,88,121103,71,7.2
Me Before You,A girl in a small town forms an unlikely bond with a recently-paralyzed man she's taking care of.,Thea Sharrock,2016,106,113322,51,7.4
Their Finest,"A former secretary, newly appointed as a scriptwriter for propaganda films, joins the cast and crew of a major production while the Blitz rages around them.",Lone Scherfig,2016,117,3739,76,7
Sully,"The story of Chesley Sullenberger, an American pilot who became a hero after landing his damaged plane on the Hudson River in order to save the flight's passengers and crew.",Clint Eastwood,2016,96,137608,74,7.5
Batman v Superman: Dawn of Justice,"Fearing that the actions of Superman are left unchecked, Batman takes on the Man of Steel, while the world wrestles with what kind of a hero it really needs.",Zack Snyder,2016,151,472307,44,6.7
The Autopsy of Jane Doe,"A father and son, both coroners, are pulled into a complex mystery while attempting to identify the body of a young woman, who was apparently harboring dark secrets.",André Øvredal,2016,86,35870,65,6.8
The Girl on the Train,A divorcee becomes entangled in a missing persons investigation that promises to send shockwaves throughout her life.,Tate Taylor,2016,112,102177,48,6.5
Fifty Shades of Grey,"Literature student Anastasia Steele's life changes forever when she meets handsome, yet tormented, billionaire Christian Grey.",Sam Taylor-Johnson,2015,125,244474,46,4.1
The Prestige,Two stage magicians engage in competitive one-upmanship in an attempt to create the ultimate stage illusion.,Christopher Nolan,2006,130,913152,66,8.5
Kingsman: The Secret Service,"A spy organization recruits an unrefined, but promising street kid into the agency's ultra-competitive training program, just as a global threat emerges from a twisted tech genius.",Matthew Vaughn,2014,129,440209,58,7.7
Patriots Day,"The story of the 2013 Boston Marathon bombing and the aftermath, which includes the city-wide manhunt to find the terrorists responsible.",Peter Berg,2016,133,39784,69,7.4
Mad Max: Fury Road,"A woman rebels against a tyrannical ruler in postapocalyptic Australia in search for her home-land with the help of a group of female prisoners, a psychotic worshipper, and a drifter named Max.",George Miller,2015,120,632842,90,8.1
Wakefield,A man's nervous breakdown causes him to leave his wife and live in his attic for several months.,Robin Swicord,2016,106,291,61,7.5
Deepwater Horizon,"A dramatization of the April 2010 disaster, when the offshore drilling rig Deepwater Horizon exploded and created the worst oil spill in U.S. history.",Peter Berg,2016,107,89849,68,7.2
The Promise,"Set during the last days of the Ottoman Empire, The Promise follows a love triangle between Michael, a brilliant medical student, the beautiful and sophisticated Ana, and Chris - a renowned American journalist based in Paris.",Terry George,2016,133,149791,49,5.9
Allied,"In 1942, a Canadian intelligence officer in North Africa encounters a female French Resistance fighter on a deadly mission behind enemy lines. When they reunite in London, their relationship is tested by the pressures of war.",Robert Zemeckis,2016,124,78079,60,7.1
A Monster Calls,A boy seeks the help of a tree monster to cope with his single mother's terminal illness.,J.A. Bayona,2016,108,39134,76,7.5
Collateral Beauty,"Retreating from life after a tragedy, a man questions the universe by writing to Love, Time and Death. Receiving unexpected answers, he begins to see how these things interlock and how even loss can reveal moments of meaning and beauty.",David Frankel,2016,97,43977,23,6.8
Zootopia,"In a city of anthropomorphic animals, a rookie bunny cop and a cynical con artist fox must work together to uncover a conspiracy.",Byron Howard,2016,108,296853,78,8.1
Pirates of the Caribbean: At World's End,"Captain Barbossa, Will Turner and Elizabeth Swann must sail off the edge of the map, navigate treachery and betrayal, find Jack Sparrow, and make their final alliances for one last decisive battle.",Gore Verbinski,2007,169,498821,50,7.1
The Avengers,Earth's mightiest heroes must come together and learn to fight as a team if they are to stop the mischievous Loki and his alien army from enslaving humanity.,Joss Whedon,2012,143,1045588,69,8.1
Inglourious Basterds,"In Nazi-occupied France during World War II, a plan to assassinate Nazi leaders by a group of Jewish U.S. soldiers coincides with a theatre owner's vengeful plans for the same.",Quentin Tarantino,2009,153,959065,69,8.3
Pirates of the Caribbean: Dead Man's Chest,"Jack Sparrow races to recover the heart of Davy Jones to avoid enslaving his soul to Jones' service, as other friends and foes seek the heart for their own agenda as well.",Gore Verbinski,2006,151,552027,53,7.3
Ghostbusters,"Following a ghost invasion of Manhattan, paranormal enthusiasts Erin Gilbert and Abby Yates, nuclear engineer Jillian Holtzmann, and subway worker Patty Tolan band together to stop the otherworldly threat.",Paul Feig,2016,116,147717,60,5.3
Inception,"A thief, who steals corporate secrets through use of dream-sharing technology, is given the inverse task of planting an idea into the mind of a CEO.",Christopher Nolan,2010,148,1583625,74,8.8
Captain Fantastic,"In the forests of the Pacific Northwest, a father devoted to raising his six kids with a rigorous physical and intellectual education is forced to leave his paradise and enter the world, challenging his idea of what it means to be a parent.",Matt Ross,2016,118,105081,72,7.9
The Wolf of Wall Street,"Based on the true story of Jordan Belfort, from his rise to a wealthy stock-broker living the high life to his fall involving crime, corruption and the federal government.",Martin Scorsese,2013,180,865134,75,8.2
Gone Girl,"With his wife's disappearance having become the focus of an intense media circus, a man sees the spotlight turned on him when it's suspected that he may not be innocent.",David Fincher,2014,149,636243,79,8.1
Furious Seven,Deckard Shaw seeks revenge against Dominic Toretto and his family for his comatose brother.,James Wan,2015,137,301249,67,7.2
Jurassic World,"A new theme park, built on the original site of Jurassic Park, creates a genetically modified hybrid dinosaur, which escapes containment and goes on a killing spree.",Colin Trevorrow,2015,124,455169,59,7
Live by Night,"A group of Boston-bred gangsters set up shop in balmy Florida during the Prohibition era, facing off against the competition and the Ku Klux Klan.",Ben Affleck,2016,129,27869,49,6.4
Avatar,A paraplegic marine dispatched to the moon Pandora on a unique mission becomes torn between following his orders and protecting the world he feels is his home.,James Cameron,2009,162,935408,83,7.8
The Hateful Eight,"In the dead of a Wyoming winter, a bounty hunter and his prisoner find shelter in a cabin currently inhabited by a collection of nefarious characters.",Quentin Tarantino,2015,187,341170,68,7.8
The Accountant,"As a math savant uncooks the books for a new client, the Treasury Department closes in on his activities and the body count starts to rise.",Gavin O'Connor,2016,128,162122,51,7.4
Prisoners,"When Keller Dover's daughter and her friend go missing, he takes matters into his own hands as the police pursue multiple leads and the pressure mounts.",Denis Villeneuve,2013,153,431185,74,8.1
Warcraft,"As an Orc horde invades the planet Azeroth using a magic portal, a few human heroes and dissenting Orcs must attempt to stop the true evil behind this war.",Duncan Jones,2016,123,187547,32,7
The Help,"An aspiring author during the civil rights movement of the 1960s decides to write a book detailing the African American maids' point of view on the white families for which they work, and the hardships they go through on a daily basis.",Tate Taylor,2011,146,342429,62,8.1
War Dogs,"Based on the true story of two young men, David Packouz and Efraim Diveroli, who won a $300 million contract from the Pentagon to arm America's allies in Afghanistan.",Todd Phillips,2016,114,106463,57,7.1
Avengers: Age of Ultron,"When Tony Stark and Bruce Banner try to jump-start a dormant peacekeeping program called Ultron, things go horribly wrong and it's up to Earth's mightiest heroes to stop the villainous Ultron from enacting his terrible plan.",Joss Whedon,2015,141,516895,66,7.4
The Nice Guys,"In 1970s Los Angeles, a mismatched pair of private eyes investigate a missing girl and the mysterious death of a porn star.",Shane Black,2016,116,175067,70,7.4
Kimi no na wa,"Two strangers find themselves linked in a bizarre way. When a connection forms, will distance be the only thing to keep them apart?",Makoto Shinkai,2016,106,34110,79,8.6
The Void,"Shortly after delivering a patient to an understaffed hospital, a police officer experiences strange and violent occurrences seemingly linked to a group of mysterious hooded figures.",Jeremy Gillespie,2016,90,9247,62,5.8
Personal Shopper,A personal shopper in Paris refuses to leave the city until she makes contact with her twin brother who previously died there. Her life becomes more complicated when a mysterious person contacts her via text message.,Olivier Assayas,2016,105,10181,77,6.3
The Departed,An undercover cop and a mole in the police attempt to identify each other while infiltrating an Irish gang in South Boston.,Martin Scorsese,2006,151,937414,85,8.5
Legend,Identical twin gangsters Ronald and Reginald Kray terrorize London during the 1960s.,Brian Helgeland,2015,132,108836,55,7
Thor,"The powerful but arrogant god Thor is cast out of Asgard to live amongst humans in Midgard (Earth), where he soon becomes one of their finest defenders.",Kenneth Branagh,2011,115,570814,57,7
The Martian,"An astronaut becomes stranded on Mars after his team assume him dead, and must rely on his ingenuity to find a way to signal to Earth that he is alive.",Ridley Scott,2015,144,556097,80,8
Contratiempo,A young businessman faces a lawyer trying to prove his innocence by the assassination of his lover.,Oriol Paulo,2016,106,7204,,7.9
The Man from U.N.C.L.E.,"In the early 1960s, CIA agent Napoleon Solo and KGB operative Illya Kuryakin participate in a joint mission against a mysterious criminal organization, which is working to proliferate nuclear weapons.",Guy Ritchie,2015,116,202973,56,7.3
Hell or High Water,A divorced father and his ex-con older brother resort to a desperate scheme in order to save their family's ranch in West Texas.,David Mackenzie,2016,102,115546,88,7.7
The Comedian,A look at the life of an aging insult comic named Jack Burke.,Taylor Hackford,2016,120,1954,40,5.4
The Legend of Tarzan,"Tarzan, having acclimated to life in London, is called back to his former home in the jungle to investigate the activities at a mining encampment.",David Yates,2016,110,117590,44,6.3
All We Had,A mother struggles to make a better life for her daughter.,Katie Holmes,2016,105,1004,48,5.8
Ex Machina,A young programmer is selected to participate in a ground-breaking experiment in synthetic intelligence by evaluating the human qualities of a breath-taking humanoid A.I.,Alex Garland,2014,108,339797,78,7.7
The Belko Experiment,"In a twisted social experiment, 80 Americans are locked in their high-rise corporate office in Bogotá, Colombia and ordered by an unknown voice coming from the company's intercom system to participate in a deadly game of kill or be killed.",Greg McLean,2016,89,3712,44,6.3
12 Years a Slave,"In the antebellum United States, Solomon Northup, a free black man from upstate New York, is abducted and sold into slavery.",Steve McQueen,2013,134,486338,96,8.1
The Bad Batch,A dystopian love story in a Texas wasteland and set in a community of cannibals.,Ana Lily Amirpour,2016,118,512,65,6.1
300,King Leonidas of Sparta and a force of 300 men fight the Persians at Thermopylae in 480 B.C.,Zack Snyder,2006,117,637104,52,7.7
Harry Potter and the Deathly Hallows: Part 2,"Harry, Ron and Hermione search for Voldemort's remaining Horcruxes in their effort to destroy the Dark Lord as the final battle rages on at Hogwarts.",David Yates,2011,130,590595,87,8.1
Office Christmas Party,"When his uptight CEO sister threatens to shut down his branch, the branch manager throws an epic Christmas party in order to land a big client and save the day, but the party gets way out of hand...",Josh Gordon,2016,105,30761,42,5.8
The Neon Demon,"When aspiring model Jesse moves to Los Angeles, her youth and vitality are devoured by a group of beauty-obsessed women who will take any means necessary to get what she has.",Nicolas Winding Refn,2016,118,50359,51,6.2
Dangal,Former wrestler Mahavir Singh Phogat and his two wrestler daughters struggle towards glory at the Commonwealth Games in the face of societal oppression.,Nitesh Tiwari,2016,161,48969,,8.8
10 Cloverfield Lane,"After getting in a car accident, a woman is held in a shelter with two men, who claim the outside world is affected by a widespread chemical attack.",Dan Trachtenberg,2016,104,192968,76,7.2
Finding Dory,"The friendly but forgetful blue tang fish, Dory, begins a search for her long-lost parents, and everyone learns a few things about the real meaning of family along the way.",Andrew Stanton,2016,97,157026,77,7.4
Miss Peregrine's Home for Peculiar Children,"When Jacob discovers clues to a mystery that stretches across time, he finds Miss Peregrine's Home for Peculiar Children. But the danger deepens after he gets to know the residents and learns about their special powers.",Tim Burton,2016,127,101058,57,6.7
Divergent,"In a world divided by factions based on virtues, Tris learns she's Divergent and won't fit in. When she discovers a plot to destroy Divergents, Tris and the mysterious Four must find out what makes Divergents dangerous before it's too late.",Neil Burger,2014,139,362093,48,6.7
